"관광지명",관광지구분,소재지도로명주소,소재지지번주소,위도,경도,면적,공공편익시설정보,숙박시설정보,운동및오락시설정보,휴양및문화시설정보,접객시설정보,지원시설정보,지정일자,수용인원수,주차가능수,관광지소개,관리기관전화번호,관리기관명,데이터기준일자
"오동도",관광지,전라남도 여수시 오동도로 222,전라남도 여수시 수정동 1-2,34.7443435,127.764121,130000,화장실+동백열차,,U-Bike,음악분수대,관광안내소,관리사무소,1968-01-01,0,356,동백을 비롯하여 194종의 울창한 의귀수목과 기암절벽이 자연스럽게 조화를 이룬 섬으로 한려해상국립공원에 속해있다. 동백꽃으로 유명한 여수의 대표 관광지이다.,061-659-1819,전라남도 여수시청,2022-11-22
"진남관",관광지,전라남도 여수시 동문로 11,전라남도 여수시 군자동 472,34.7413383,127.7365704,792,화장실,,,임란유물전시관,관광안내소,관리사무소,2001-04-17,0,102,국보 제 304호 국내 최대 단층목조건물로 조선시대 400여 년간 조선수군의 본거지로 이용되었던 역사의 현장이다. 2020년 12월까지 보수공사중이다.,061-659-5710,전라남도 여수시청,2022-11-22
"향일암",관광지,전라남도 여수시 돌산읍 향일암로 60,전라남도 여수시 율림리 산 7,34.59379448,127.8029861,0,화장실,,,,관광안내소,매표소+종무소,2012-05-06,0,109,우리나라 4대 관음기도도량 중 하나로 전국 최고의 일출명소이다. 644년 원효대사에 의해 창건되었다고 전해진다.,061-644-0309,대한불교조계종,2022-11-22
"여수해상케이블카",관광지,전라남도 여수시 자산4길 39,전라남도 여수시 수정동 332-57,34.7402223,127.7529197,0,화장실,,판타지아트뮤지엄,공연장,매표소,사무소,2014-12-02,355,244,"여수 돌산과 자산공원을 잇는 1.5km구간의 국내 첫 해상케이블카로 바닥이 투명한 크리스탈 캐빈 15대(5인승)와 일반 캐빈 35대(8인승), 총 50대가 운행되고 있다. 아찔한 스릴감과 함께 맛보는 다도해의 전망과 여수밤바다 풍경이 한눈에 들어온다.",061-664-7301,여수해상케이블카 주식회사,2022-11-22
"여수세계박람회장",관광지,전라남도 여수시 박람회길 1,전라남도 여수시 덕충동 2005,34.75218956,127.7465005,598000,화장실,소노캄+베네치아호텔+유탑마리나리조트+신라스테이,아쿠아플라넷+빅오쇼,엑스포아트갤러리+엑스포기념관,안내소,사무실,2012-04-30,0,1909,2012년 여수세계박람회를 성공적으로 개최한 장소로 단순 공원이 아닌 관광부터 비즈니스까지 원스톱으로 즐길 수 있는 전천후 복합문화체험공단.,1577-2012,2012여수세계박람회재단,2022-11-22
"여수해양공원",관광지,전라남도 여수시 하멜로 96,전라남도 여수시 종화동 458-5,34.73676698,127.7484079,0,화장실,,,공연장+놀이터,관광안내소,관리사무소,2012-01-01,0,214,"해안선을 따라 조성된 1.5km 구간 시민공원으로 아름다운 여수 밤바다를 만끽 할 수 있는 최고의 휴식공간이다. 하멜등대, 해양케이블카, 돌산대교, 거북선대교, 장군도 등이 한눈에 보여 밤바다를 거닐 수 있는 필수 데이트 코스이며, 또한 각종 공연 및 행사가 다채롭게 열려 볼거리가 많다.",061-659-3962,전라남도 여수시청,2022-11-22
"예술랜드리조트",관광지,"전라남도 여수시 돌산읍 무술목길 142-1,",전라남도 여수시 돌산읍 평사리 산244,34.69510702,127.7769452,65904,화장실+푸드코트,리조트,인피니티풀+트릭아트뮤지엄+조각공원,,안내데스크,안내데스크,2018-07-15,0,0,"전 객실 오션뷰, AR로 체험하는 국내 최대 테마형 3D트릭아트뮤지엄, +60미터 미디어 터널과 150미터 암반터널을 통해 만나는 조각공원, 바다를 바라보는 여수 최대규모 1500평 인피니티 풀로 새로운 종합관광지로 자리잡았다.",1522-2600,(주)여수예술랜드,2022-11-22
"여수이순신대교",관광지,전남 여수시 묘도7길 110,전남 여수시 묘도동 산127-37,34.888766,127.705501,0,화장실,,,전망대,안내데스크,사무실,2013-02-08,0,0,"세계최고의 높이를 자랑하는 주탑높이(270m)는 63빌딩보다 높고 주탑간 거리 1,545m는 충무공 이순신 장군의 탄신해인 1545년을 기념하기 위한 것으로 웅장함과 탁 뜨인 바다 전경이 일품이다.",061-807-2020,국토교통부,2022-11-22
