"관광지명",관광지구분,소재지도로명주소,소재지지번주소,위도,경도,면적,공공편익시설정보,숙박시설정보,운동및오락시설정보,휴양및문화시설정보,접객시설정보,지원시설정보,지정일자,수용인원수,주차가능수,관광지소개,관리기관전화번호,관리기관명,데이터기준일자
"담양호국민관광지",관광지,,전라남도 담양군 용면 월계리 149-67,35.4019831,126.9990829,47920000,관리사무소+공중화장실+전망대+정수장+주차장+도로,국민숙사(해피랜드호텔)+펜션(오쑈),운동시설지구,조경 및 휴게시설+용마루길+추월산 등산로,목포맛집+수정횟집+초원의집,가마골생태공원+JK통나무펜션단지(비호재지구),1988-11-29,10000,500,"담양호 국민관광지는 영산강 시원지인 가마골생태공원(용소)과 청정하고 맑은 담양호, 산세가 좋은 추월산, 역사의 흔적이 깊이 남아있는 금성산성에 이르기까지 힐링과 역사의 숨결이 살아있는 천혜의 관광지임",061-380-2793,전라남도 담양군 관광과(담양호권관광지관리팀),2023-09-13
"죽녹원",관광지,전라남도 담양군 담양읍 죽녹원로 119,전라남도 담양군 담양읍 향교리 산37-6,35.32535666,126.9866155,310238,관리사무소+공중화장실+전망대+정자,한옥체험장(12객실),어린이놀이터,조경 및 휴게시설+생태전시관(이이남아트센터),향교죽녹원+죽녹원식당,,2000-01-02,3800,70,"2003년 5월에 조성하여 약 31만㎡의 울창한 대나무숲이 펼쳐져 있음. 죽림욕을 즐길수 있는 2.4km의 산책로가 있으며, 가사문학의 산실 담양의 정자문화를 대표하는 6정자를 재현하하고, 밤에는 별을 보며 한옥을 체험할 수 있는 공간이 조성되어있음",061-380-2782,전라남도 담양군 산림정원과(대숲정원팀),2023-09-13
"메타세쿼이아랜드",관광지,,전라남도 담양군 담양읍 학동리 578-4,35.32342607,127.001993,117998,메타세쿼이아길 L=2.1km+어린이프로방스+영화세트장+개구리생태공원+에코허브센터+호남기후변화체험관+매표소 3개소+검표소 6개소+쉼터 2개소+화장실 4개소,메종드프로방스+담양프로방스펜션,어린이프로방스+카페테리아+곤충박물관,조경 및 휴게시설,명가정+담양갈비창고,,2010-01-13,1400,2000,"아름다운 숲 전국대회 부문 대상등 3회 수상에 빛나는 메타세쿼이아 길은 현재 메타세쿼이아 랜드로 조례개정하여 메타세쿼이아 길 외 어린이프로방스, 호남기후변화체험관, 개구리생태공원, 에코허브센터, 곤충박물관, 카페테리아 등 유원시설을 운영 및 공사 중이다. 메타세쿼이아 길을 사색하며 걷는것 외에도 체험 및 어린이를 위한 시설확충으로 담양을 대표하는 유원지 중 하나임",061-380-3161,전라남도 담양군 관광과(관광시설팀),2023-09-13
"소쇄원",관광지,전라남도 담양군 가사문학면 소쇄원길 17,전라남도 담양군 가사문학면 지곡리 123,35.18433903,127.0121793,4060,관리사무소(매표소),,,조경 및 휴게시설,대가,,2008-05-02,600,90,"1983년 7월 20일 사적 제304호로 지정되었다가 2008년 5월 2일 명승 제40호로 변경되었다. 전체 면적은 4,060㎡(지정구역), 118,866㎡(보호구역)이다. 이곳은 물이 흘러내리는 계곡을 사이에 두고 각 건물을 지어 자연과 인공이 조화를 이루는 대표적 정원이다.",061-380-2819,전라남도 담양군 문화체육과(문화재팀),2023-09-13
"한국대나무박물관",관광지,전라남도 담양군 담양읍 죽향문화로 35,전라남도 담양군 담양읍 천변리 401-1,35.30934367,126.9764088,3300,관리사무소(매표소),,,조경 및 휴게시설,박물관앞집,,1991-06-27,260,150,"1981년에 죽물박물관이 개관된 후 전국 유일의 죽제품 주산지로서 보존, 전시, 시연, 판매 등 종합기능을 수행할 공간을 갖추어 대나무공예문화 전통 계승과 대나무공예 진흥의 계기를 마련하고자 1998년에 현재의 위치에 확장 이전하여 2003년에 한국대나무박물관으로 명칭을 변경하여 운영",061-380-2902,전라남도 담양군 공공시설사업소(한국대나무박물관팀),2023-09-13
"한국가사문학관",관광지,전라남도 담양군 가사문학면 가사문학로 877,전라남도 담양군 가사문학면 지곡리 319,35.18796216,127.0054858,2022,한옥형 본관+매표소+화장실,,,기획전시실(갤러리)+자미정+세심정+토산품전시장+전통찻집,대가,,2018-04-11,250,90,"가사문학 관련 문화유산의 전승, 보전과 현대적 계승, 발전을 위하여 2000년 10월 완공. 1만 6,556㎡의 부지에 2,022㎡ 규모의 한옥형 본관과 기획전시실(갤러리), 자미정, 세심정, 토산품전시장, 전통찻집 등의 부대시설을 갖추고 있음",061-380-2702,전라남도 담양군 문화체육과(한국가사문학관팀),2023-09-13
"슬로시티삼지내마을",관광지,전라남도 담양군 창평면 돌담길 56-24,전라남도 담양군 창평면 창평리 113-1,35.23522516,127.0178498,15680,관리사무소+공중화장실,돌담집 민박+한옥애+하심당,,,약초밥상,,2007-12-01,470,300,"담양은 예로부터의 고택이 많이 남아 있으며 아직도 인근에 문화재가 많이 있다. 도심 인근의 농촌인데도 전통문화가 많이 남아 있어 현대와 전통이 조화를 이루고 있는 대표적 마을이기도 하다. 특히 삼지천 마을의 고택, 한옥마을에 펼쳐진 돌담길에서의 여유로운 산책은 방문객들의 슬로라이프 체험의 장이기도 하다.",061-380-3159,전라남도 담양군 관광과(슬로시티팀),2023-09-13
